{
  "contract": "publishing-house.workflow-run-summary/v1",
  "schema_name": "publishing-house.workflow-run-summary",
  "schema_version": "1.0.0",
  "workflow_id": "publishing-house-daily-desk",
  "workflow_version": "0.1.0",
  "run_id": "run-fixture",
  "correlation_id": "correlation-fixture",
  "created_at": "2026-08-14T12:00:00Z",
  "actor": "fixture-operator",
  "permission_mode": "PROPOSE",
  "current_state": "completed",
  "next_action": "start commissioning",
  "tool_record_references": [],
  "artifact_checksums": [],
  "agent_step_receipts": [],
  "dispatch_artifacts": [],
  "external_effect_declared": false,
  "external_effect_occurred": false,
  "provenance": [
    {
      "kind": "fixture"
    }
  ]
}
